commit	f1	memory_gb	status	description
6b5605b	0.000000	0.0	crash	The crash log indicates a `NameError: name 'self' is not defined` at line 152 where `nn.Conv1d(self.
d3ca505	0.000000	0.0	crash	Based on the crash log and experiment history, we are stuck at F1 = 0.683487 with a TransformerEncod
auto	2026-07-02 09:31:14	0.642749	0.678258	0.000000	0.693297	0.556691	
7e7a563	0.642749	5.4	discard	# Hyperparameters
283be25	0.000000	0.0	crash	Looking at the experiment history, we are currently stuck at **F1 = 0.683487**. The model uses a `Tr
auto	2026-07-02 09:39:28	0.683309	0.725104	0.000000	0.727454	0.597369	
a11e8ef	0.683309	5.4	discard	The crash log indicates a `NameError: name 'dropout' is not defined` at line 150 inside the `MLPBloc
6d4ba56	0.000000	0.0	crash	self.fusion_layers = nn.TransformerEncoder(
auto	2026-07-02 09:48:49	0.578328	0.588052	0.000000	0.623846	0.523085	
7043e52	0.578328	4.9	discard	self.fusion_layers = nn.TransformerEncoder(
